{
  "snapshot_id": "G-S01",
  "clan": "GOLDENCROWN",
  "official_timestamp_persian": "1405-06-27 24:00",
  "captured_at_utc": "2026-09-18T20:30:00Z",
  "member_count": 50,
  "baseline_rule": {
    "total_kills": "baseline",
    "clan_medals": "baseline",
    "kills_delta": null,
    "clan_medals_delta": null
  },
  "members": [
    {
      "snapshot_member_key": "G-S01-R001",
      "player_id": null,
      "rank": 1,
      "rank_movement": null,
      "display_name": "ehsan",
      "role": "Co-Leader",
      "stage": 68,
      "league_medals": 180712,
      "league_medals_delta": null,
      "clan_medals": 1515874,
      "clan_medals_delta": null,
      "total_kills": 249732,
      "kills_delta": null
    },
    {
      "snapshot_member_key": "G-S01-R002",
      "player_id": null,
      "rank": 2,
      "rank_movement": null,
      "display_name": "JoseGregorio",
      "role": "Member",
      "stage": 158,
      "league_medals": 159614,
      "league_medals_delta": null,
      "clan_medals": 913754,
      "clan_medals_delta": null,
      "total_kills": 1014125,
      "kills_delta": null
    },
    {
      "snapshot_member_key": "G-S01-R003",
      "player_id": null,
      "rank": 3,
      "rank_movement": null,
      "display_name": "ДАВИД",
      "role": "Member",
      "stage": 231,
      "league_medals": 120081,
      "league_medals_delta": null,
      "clan_medals": 128103,
      "clan_medals_delta": null,
      "total_kills": 782205,
      "kills_delta": null
    },
    {
      "snapshot_member_key": "G-S01-R004",
      "player_id": null,
      "rank": 4,
      "rank_movement": null,
      "display_name": "F 35",
      "role": "Co-Leader",
      "stage": 54,
      "league_medals": 109447,
      "league_medals_delta": null,
      "clan_medals": 1123078,
      "clan_medals_delta": null,
      "total_kills": 236207,
      "kills_delta": null
    },
    {
      "snapshot_member_key": "G-S01-R005",
      "player_id": null,
      "rank": 5,
      "rank_movement": null,
      "display_name": "MaZmoud",
      "role": "Member",
      "stage": 70,
      "league_medals": 87673,
      "league_medals_delta": null,
      "clan_medals": 161024,
      "clan_medals_delta": null,
      "total_kills": 167467,
      "kills_delta": null
    },
    {
      "snapshot_member_key": "G-S01-R006",
      "player_id": null,
      "rank": 6,
      "rank_movement": null,
      "display_name": "RADMAN",
      "role": "Member",
      "stage": 49,
      "league_medals": 74089,
      "league_medals_delta": null,
      "clan_medals": 687187,
      "clan_medals_delta": null,
      "total_kills": 208929,
      "kills_delta": null
    },
    {
      "snapshot_member_key": "G-S01-R007",
      "player_id": null,
      "rank": 7,
      "rank_movement": null,
      "display_name": "Worker Ant",
      "role": "Member",
      "stage": 59,
      "league_medals": 70630,
      "league_medals_delta": null,
      "clan_medals": 1062602,
      "clan_medals_delta": null,
      "total_kills": 244705,
      "kills_delta": null
    },
    {
      "snapshot_member_key": "G-S01-R008",
      "player_id": null,
      "rank": 8,
      "rank_movement": null,
      "display_name": "Shahram68",
      "role": "Member",
      "stage": 39,
      "league_medals": 66879,
      "league_medals_delta": null,
      "clan_medals": 66879,
      "clan_medals_delta": null,
      "total_kills": 147430,
      "kills_delta": null
    },
    {
      "snapshot_member_key": "G-S01-R009",
      "player_id": null,
      "rank": 9,
      "rank_movement": null,
      "display_name": "Masoudpas_4612",
      "role": "Member",
      "stage": 27,
      "league_medals": 61047,
      "league_medals_delta": null,
      "clan_medals": 297949,
      "clan_medals_delta": null,
      "total_kills": 137109,
      "kills_delta": null
    },
    {
      "snapshot_member_key": "G-S01-R010",
      "player_id": null,
      "rank": 10,
      "rank_movement": null,
      "display_name": "Dariush",
      "role": "Elder",
      "stage": 34,
      "league_medals": 58605,
      "league_medals_delta": null,
      "clan_medals": 622682,
      "clan_medals_delta": null,
      "total_kills": 116978,
      "kills_delta": null
    },
    {
      "snapshot_member_key": "G-S01-R011",
      "player_id": null,
      "rank": 11,
      "rank_movement": null,
      "display_name": "ایران",
      "role": "Member",
      "stage": 35,
      "league_medals": 57432,
      "league_medals_delta": null,
      "clan_medals": 285732,
      "clan_medals_delta": null,
      "total_kills": 79611,
      "kills_delta": null
    },
    {
      "snapshot_member_key": "G-S01-R012",
      "player_id": null,
      "rank": 12,
      "rank_movement": null,
      "display_name": "MyLord",
      "role": "Member",
      "stage": 39,
      "league_medals": 55396,
      "league_medals_delta": null,
      "clan_medals": 231633,
      "clan_medals_delta": null,
      "total_kills": 282373,
      "kills_delta": null
    },
    {
      "snapshot_member_key": "G-S01-R013",
      "player_id": null,
      "rank": 13,
      "rank_movement": null,
      "display_name": "meysam javid",
      "role": "Member",
      "stage": 34,
      "league_medals": 54727,
      "league_medals_delta": null,
      "clan_medals": 54727,
      "clan_medals_delta": null,
      "total_kills": 82883,
      "kills_delta": null
    },
    {
      "snapshot_member_key": "G-S01-R014",
      "player_id": null,
      "rank": 14,
      "rank_movement": null,
      "display_name": "boz qurd",
      "role": "Member",
      "stage": 25,
      "league_medals": 53162,
      "league_medals_delta": null,
      "clan_medals": 90624,
      "clan_medals_delta": null,
      "total_kills": 76741,
      "kills_delta": null
    },
    {
      "snapshot_member_key": "G-S01-R015",
      "player_id": null,
      "rank": 15,
      "rank_movement": null,
      "display_name": "Power",
      "role": "Member",
      "stage": 36,
      "league_medals": 51427,
      "league_medals_delta": null,
      "clan_medals": 102371,
      "clan_medals_delta": null,
      "total_kills": 98443,
      "kills_delta": null
    },
    {
      "snapshot_member_key": "G-S01-R016",
      "player_id": null,
      "rank": 16,
      "rank_movement": null,
      "display_name": "Jul",
      "role": "Member",
      "stage": 26,
      "league_medals": 49481,
      "league_medals_delta": null,
      "clan_medals": 132527,
      "clan_medals_delta": null,
      "total_kills": 84771,
      "kills_delta": null
    },
    {
      "snapshot_member_key": "G-S01-R017",
      "player_id": null,
      "rank": 17,
      "rank_movement": null,
      "display_name": "ALI",
      "role": "Member",
      "stage": 46,
      "league_medals": 44576,
      "league_medals_delta": null,
      "clan_medals": 44576,
      "clan_medals_delta": null,
      "total_kills": 104882,
      "kills_delta": null
    },
    {
      "snapshot_member_key": "G-S01-R018",
      "player_id": null,
      "rank": 18,
      "rank_movement": null,
      "display_name": "ARM CR7",
      "role": "Member",
      "stage": 36,
      "league_medals": 42784,
      "league_medals_delta": null,
      "clan_medals": 125218,
      "clan_medals_delta": null,
      "total_kills": 139395,
      "kills_delta": null
    },
    {
      "snapshot_member_key": "G-S01-R019",
      "player_id": null,
      "rank": 19,
      "rank_movement": null,
      "display_name": "hamid.iran",
      "role": "Member",
      "stage": 14,
      "league_medals": 38809,
      "league_medals_delta": null,
      "clan_medals": 309663,
      "clan_medals_delta": null,
      "total_kills": 42683,
      "kills_delta": null
    },
    {
      "snapshot_member_key": "G-S01-R020",
      "player_id": null,
      "rank": 20,
      "rank_movement": null,
      "display_name": "ADA",
      "role": "Member",
      "stage": 28,
      "league_medals": 37526,
      "league_medals_delta": null,
      "clan_medals": 85006,
      "clan_medals_delta": null,
      "total_kills": 125030,
      "kills_delta": null
    },
    {
      "snapshot_member_key": "G-S01-R021",
      "player_id": null,
      "rank": 21,
      "rank_movement": null,
      "display_name": "Sajjad",
      "role": "Member",
      "stage": 48,
      "league_medals": 35088,
      "league_medals_delta": null,
      "clan_medals": 409842,
      "clan_medals_delta": null,
      "total_kills": 181740,
      "kills_delta": null
    },
    {
      "snapshot_member_key": "G-S01-R022",
      "player_id": null,
      "rank": 22,
      "rank_movement": null,
      "display_name": "محمد",
      "role": "Member",
      "stage": 20,
      "league_medals": 34951,
      "league_medals_delta": null,
      "clan_medals": 343355,
      "clan_medals_delta": null,
      "total_kills": 63929,
      "kills_delta": null
    },
    {
      "snapshot_member_key": "G-S01-R023",
      "player_id": null,
      "rank": 23,
      "rank_movement": null,
      "display_name": "Morteza Safari",
      "role": "Member",
      "stage": 46,
      "league_medals": 33368,
      "league_medals_delta": null,
      "clan_medals": 197893,
      "clan_medals_delta": null,
      "total_kills": 120793,
      "kills_delta": null
    },
    {
      "snapshot_member_key": "G-S01-R024",
      "player_id": null,
      "rank": 24,
      "rank_movement": null,
      "display_name": "Reza_Gh",
      "role": "Member",
      "stage": 25,
      "league_medals": 31029,
      "league_medals_delta": null,
      "clan_medals": 310811,
      "clan_medals_delta": null,
      "total_kills": 81430,
      "kills_delta": null
    },
    {
      "snapshot_member_key": "G-S01-R025",
      "player_id": null,
      "rank": 25,
      "rank_movement": null,
      "display_name": "majid",
      "role": "Member",
      "stage": 38,
      "league_medals": 28338,
      "league_medals_delta": null,
      "clan_medals": 305412,
      "clan_medals_delta": null,
      "total_kills": 140076,
      "kills_delta": null
    },
    {